{
  "dependencies": {
    "accelerated": [],
    "dev": [
      "interpax",
      "jsonschema",
      "lineax",
      "magpylib-jax",
      "pytest",
      "pytest-cov",
      "pytest-timeout",
      "pytest-xdist"
    ],
    "docs": [
      "furo",
      "myst-parser",
      "sphinx",
      "sphinx-copybutton"
    ],
    "magnetic": [
      "magpylib-jax"
    ],
    "release": [
      "build",
      "twine"
    ],
    "runtime": [
      "jax",
      "jaxlib",
      "matplotlib",
      "numpy",
      "scipy",
      "solvax==0.5.1",
      "tomli; python_version < '3.11'"
    ]
  },
  "generated_by": "scripts/manage_provenance.py",
  "lock": {
    "format": "uv",
    "path": "uv.lock",
    "revision": 3,
    "sha256": "deef30d5136260e7906fa807b878cbe437ebe893b9e05b896f37c8cad9d793b6",
    "version": 1
  },
  "numerical_policy": {
    "jax_enable_x64": true
  },
  "portable_gate": {
    "branch_coverage_percent": 95.0,
    "budget_seconds": 600,
    "command": "python scripts/run_full_test_suite.py",
    "default_workers": 4,
    "warning_seconds": 450
  },
  "project": {
    "name": "lmx",
    "version": "1.1.3"
  },
  "python": {
    "ci_tested": [
      "3.10",
      "3.13"
    ],
    "requires": ">=3.10,<3.14"
  },
  "repository_inventory": {
    "benchmark_specs": [
      "benchmarks/specs/alex-b1-pipe.toml",
      "benchmarks/specs/alex-b2-square.toml",
      "benchmarks/specs/hunt-ha20.toml",
      "benchmarks/specs/shercliff-ha20.toml"
    ],
    "examples": [
      "campaigns/autodiff/autodiff_extruded_field_design_demo.py",
      "campaigns/autodiff/autodiff_extruded_target_demo.py",
      "campaigns/autodiff/autodiff_extruded_trajectory_demo.py",
      "campaigns/autodiff/autodiff_fringing_design_demo.py",
      "campaigns/autodiff/autodiff_fringing_response_demo.py",
      "campaigns/autodiff/autodiff_profile_design_demo.py",
      "campaigns/autodiff/autodiff_sensitivity_demo.py",
      "campaigns/autodiff/autodiff_wham_pressure_sensitivity.py",
      "campaigns/blanket/wham_blanket_autodiff_research_demo.py",
      "campaigns/blanket/wham_blanket_current_closure_demo.py",
      "campaigns/blanket/wham_blanket_field_on_mesh_demo.py",
      "campaigns/blanket/wham_blanket_flow_demo.py",
      "campaigns/blanket/wham_blanket_geometry_preview.py",
      "campaigns/blanket/wham_blanket_mesh_demo.py",
      "campaigns/blanket/wham_coil_model_field_adapter.py",
      "campaigns/blanket/wham_mirror_pipe_demo.py",
      "campaigns/ducts/hartmann_validation_ladder.py",
      "campaigns/ducts/hunt_showcase.py",
      "campaigns/ducts/shercliff_example.py",
      "campaigns/ducts/shercliff_showcase.py",
      "campaigns/ducts/straight_duct_geometry_and_mesh.py",
      "campaigns/ducts/straight_duct_profile_comparison.py",
      "campaigns/ducts/straight_duct_validation_ladder.py",
      "campaigns/fields/variable_field_bent_pipe_demo.py",
      "campaigns/fields/variable_field_geometry_demo.py",
      "campaigns/fields/variable_field_layered_demo.py",
      "campaigns/fields/variable_field_tabulated_demo.py",
      "campaigns/fields/variable_field_validation.py",
      "campaigns/freemhd/freemhd_closed_channel_flow_rate_parity.py",
      "campaigns/freemhd/freemhd_closed_channel_parity.py",
      "campaigns/freemhd/freemhd_observable_mesh_ladder.py",
      "campaigns/fringing/bent_pipe_inductionless_demo.py",
      "campaigns/fringing/bent_pipe_preview.py",
      "campaigns/fringing/dean_literature_validation.py",
      "campaigns/fringing/dean_vortex_bayat_rezai_strict_attempt.py",
      "campaigns/fringing/dean_vortex_external_reference_template.py",
      "campaigns/fringing/extruded_summary_figures.py",
      "campaigns/fringing/extruded_validation_campaign.py",
      "campaigns/interfaces/interface_conductivity_verification_demo.py",
      "campaigns/magnetic_obstacle/magnetic_obstacle_baseline.py",
      "campaigns/magnetic_obstacle/magnetic_obstacle_benchmark.py",
      "campaigns/magnetic_obstacle/magnetic_obstacle_external_reference_template.py",
      "campaigns/magnetic_obstacle/magnetic_obstacle_regime_scan.py",
      "campaigns/magnetic_obstacle/magnetic_obstacle_votyakov_curve_validation.py",
      "campaigns/magnetic_obstacle/magnetic_obstacle_votyakov_strict_attempt.py",
      "campaigns/publication/publication_figure_campaign.py",
      "campaigns/q2d/q2d_decay_validation.py",
      "campaigns/q2d/q2d_forced_validation.py",
      "campaigns/q2d/q2d_lmx_q2dmhdfoam_lid_driven_parity.py",
      "campaigns/q2d/q2d_lmx_q2dmhdfoam_turbulence_comparison.py",
      "campaigns/q2d/q2d_turbulence_decay_demo.py",
      "campaigns/q2d/q2d_turbulence_external_reference_template.py",
      "campaigns/q2d/q2d_wall_bounded_validation.py",
      "campaigns/q2d/q2dmhdfoam_docker_reference_validation.py",
      "campaigns/q2d/q2dmhdfoam_external_reference_adapter.py",
      "campaigns/q2d/q2dmhdfoam_lid_driven_vtk_artifact.py",
      "campaigns/q2d/q2dmhdfoam_lmx_turbulence_match_audit.py",
      "campaigns/status/external_validation_readiness_panel.py",
      "campaigns/status/reference_slice_mesh_diagnostic.py",
      "campaigns/status/research_grade_closure_dashboard.py",
      "campaigns/status/research_grade_closure_status.py",
      "campaigns/status/research_grade_external_data_audit.py",
      "campaigns/status/research_grade_external_target_figures.py",
      "campaigns/status/research_grade_final_lane_disposition.py",
      "campaigns/status/research_grade_strict_blocker_probe.py",
      "campaigns/tutorials/geometry_panel_demo.py",
      "campaigns/tutorials/geometry_preview_demo.py",
      "campaigns/tutorials/operator_clustered_verification_demo.py",
      "campaigns/tutorials/plot_npz_results.py",
      "campaigns/tutorials/plotting_api_demo.py",
      "campaigns/tutorials/readme_showcase_demo.py",
      "campaigns/tutorials/theory_meeting_demo.py",
      "campaigns/walls/li_aln_multilayer_convergence.py",
      "campaigns/walls/li_aln_multilayer_mesh_qa.py",
      "campaigns/walls/li_aln_multilayer_solve.py",
      "campaigns/walls/li_aln_wall_stack_phase0_2.py",
      "campaigns/walls/li_aln_wall_stack_phase3_6.py",
      "cases/ducts/hartmann_restart_case.toml",
      "cases/ducts/hunt_case.toml",
      "cases/ducts/shercliff_case.toml",
      "cases/fringing/fringing_layered_case.toml",
      "cases/fringing/fringing_layered_restart_case.toml",
      "cases/fringing/fringing_pipe_case.toml",
      "cases/fringing/fringing_rect_case.toml",
      "cases/fringing/fringing_tabulated_case.toml",
      "examples/autodiff_design_demo.py",
      "examples/catalog.toml",
      "examples/extruded_restart_demo.py",
      "examples/freemhd_closed_channel_observable_parity.py",
      "examples/fringing_benchmark_demo.py",
      "examples/hartmann_case.toml",
      "examples/hartmann_example.py",
      "examples/hunt_example.py",
      "examples/operator_verification_demo.py",
      "examples/pipe_reference_comparison_demo.py",
      "examples/strong_scaling_demo.py",
      "examples/variable_field_extruded_demo.py"
    ],
    "modules": [
      "lmx/__init__.py",
      "lmx/__main__.py",
      "lmx/_autodiff.py",
      "lmx/_fringing.py",
      "lmx/_fringing_types.py",
      "lmx/_plotting.py",
      "lmx/_solvers.py",
      "lmx/_validation.py",
      "lmx/autodiff.py",
      "lmx/benchmarks.py",
      "lmx/blanket_flow.py",
      "lmx/blanket_geometry.py",
      "lmx/cases.py",
      "lmx/centerline_fields.py",
      "lmx/cli.py",
      "lmx/config.py",
      "lmx/core.py",
      "lmx/dean.py",
      "lmx/example_runner.py",
      "lmx/external_validation.py",
      "lmx/field_models.py",
      "lmx/freemhd.py",
      "lmx/fringing.py",
      "lmx/io.py",
      "lmx/jax_setup.py",
      "lmx/linear.py",
      "lmx/mesh.py",
      "lmx/operators.py",
      "lmx/physics.py",
      "lmx/plotting.py",
      "lmx/publication.py",
      "lmx/q2d.py",
      "lmx/reference_data.py",
      "lmx/research_blockers.py",
      "lmx/research_closure.py",
      "lmx/research_figures.py",
      "lmx/runtime_logging.py",
      "lmx/scaling.py",
      "lmx/showcase.py",
      "lmx/solvers.py",
      "lmx/specs.py",
      "lmx/units.py",
      "lmx/validation.py",
      "lmx/wall_models.py",
      "lmx/wall_study.py"
    ],
    "scripts": [
      "scripts/__init__.py",
      "scripts/analyze_freemhd_benchmark_a_ladder.py",
      "scripts/audit_architecture.py",
      "scripts/benchmark_solvax_pcg_backend.py",
      "scripts/build_benchmark_a_acceptance.py",
      "scripts/compare_hunt_trace_histories.py",
      "scripts/freeze_benchmark_b_specs.py",
      "scripts/freeze_freemhd_benchmark_a.py",
      "scripts/freeze_samper_table_i.py",
      "scripts/freeze_solvax_pcg_acceptance.py",
      "scripts/inspect_starting_files_archive.py",
      "scripts/manage_provenance.py",
      "scripts/manage_release_assets.py",
      "scripts/materialize_freemhd_benchmark_a.py",
      "scripts/materialize_starting_case.py",
      "scripts/run_benchmark_b_independence.py",
      "scripts/run_benchmark_b_quantitative.py",
      "scripts/run_benchmark_suite.py",
      "scripts/run_convergence_suite.py",
      "scripts/run_freemhd_parity_suite.py",
      "scripts/run_full_test_suite.py",
      "scripts/run_full_validation_exercise.py",
      "scripts/run_hunt_solver_diagnostic_report.py",
      "scripts/run_manual_solver_family_validation.py",
      "scripts/run_reference_parity_report.py",
      "scripts/run_release_readiness.py",
      "scripts/run_samper_table_i.py",
      "scripts/run_solver_control_sweep.py",
      "scripts/run_solver_grid_sweep.py",
      "scripts/run_strong_scaling_worker.py",
      "scripts/run_time_convergence_suite.py",
      "scripts/run_validation_suite.py",
      "scripts/summarize_ci_artifacts.py"
    ],
    "tests": [
      "tests/test_architecture_audit.py",
      "tests/test_autodiff.py",
      "tests/test_benchmark_a_ladder_analysis.py",
      "tests/test_benchmark_solvax_pcg_backend.py",